Product Name,Product Price
Proton Saga Mitsuboshi CPK865 Original Fan Belt Brand New,RM 18.00
4D68 For MITSUBISHI GALANT OR PROTON PERSONA 400 Engine Rebuild Kits Auto Engine,RM 410.74
Tail Lamp Proton Perdana V6 RH,RM 250.00
New ListingProton Satria Phase 1 94-05 Drivers Manual Door Mirror,RM 177.72
New ListingProton Satria 94-05 Passenger Electric Window Regulator,RM 201.76
"5PK865 GATES V-Ribbed Belt for BMW,BYD,FERRARI,MITSUBISHI,PROTON,TOYOTA,ZHONGHUA",RM 203.89
New Listing1 987 949 536 ENGINE TIMING BELT CAM BELT BOSCH NEW OE REPLACEMENT,RM 189.83
"CT841 CONTITECH TIMING BELT (Mitsubishi, Proton 1.6 92-) NEW O.E SPEC!",RM 191.25
"New ListingENGINE TIMING BELT CAM BELT CONTITECH CT738 A FOR PROTON PERSONA 400,WIRA",RM 189.00
New ListingENGINE TIMING BELT CAM BELT CONTITECH CT821 P FOR PROTON PERSONA 400 1.8L 85KW,RM 283.94
Keilrippenriemen MAPCO 261675 für AUDI CITROËN FIAT FORD PEUGEOT PROTON RENAULT,RM 105.21
Timing Belt fits PROTON SATRIA 1.6 96 to 00 4G92 Contitech MD176386 Quality New,RM 170.84
New Genuine DAYCO Timing Belt Camshaft For Proton Persona Satria Wira #94510,RM 662.80
DAYCO TIMING BELT KIT for PROTON SUPRIMA 01/2014-on 1.6 4cyl TMPFI TURBO CR IAFM,RM 372.80
BOSCH ZAHNRIEMEN STEUERRIEMEN 1 987 949 518 P FÜR PROTON SAVVY 1.2 1.2L 55KW,RM 167.48
GATES Timing Belt/Water Pump Kit for Proton Savvy 1.2 Oct 2005 to Oct 2012,RM 732.44
New DAYCO Timing Belt Kit For Proton M21 KTBA120,RM 645.71
"GATES K014PK928 V-Ribbed Belt Set for DACIA,NISSAN,PROTON,RENAULT",RM 287.61
Courroie Dentée AE TB380 Compatible Avec Dayco KTB380 - Mitsubishi/Proton,RM 68.13
"New ListingBOSCH ZAHNRIEMEN STEUERRIEMEN 1 987 948 832 P FÜR PROTON SATRIA,PERSONA 400",RM 182.76
Timing Belt fits PROTON 1.5 1.5 88 to 91 QH MD113564 Genuine Quality Guaranteed,RM 107.64
GATES Timing Belt Kit To Suit Proton Persona 316 GLXi Petrol,RM 500.22
Dayco Timing Belt T1353 fits MITSUBISHI/ PROTON 94904,RM 195.71
ZAHNRIEMEN STEUERRIEMEN BOSCH 1 987 949 064 P NEU OE QUALITÄT,RM 116.87
"New V-Ribbed Belt for ROVER PROTON MG LAND ROVER:200 Coupe,400 Tourer, CDU2160",RM 87.76
Brand New DAYCO Timing Belt to fit Proton Wira 2005-2009,RM 211.27
Brand New DAYCO Timing Belt to fit Proton Wira 1996-2000,RM 528.18
Timing Belt fits PROTON COMPACT C9 1.6 97 to 00 4G92 QH MD176386 Quality New,RM 182.71
HI-FLOW THERMOSTAT TT281-180 SUIT LEXUS MITSUBISHI NISSAN PROTON TOYOTA,RM 117.91
"New ListingENGINE TIMING BELT CAM BELT BOSCH 1 987 948 825 P FOR MITSUBISHI GALANT V,L 400",RM 218.67
New ListingProton Satria Phase 1 94-05 Digital Display Clock,RM 177.72
Correa Dentada AE TB379 Compatible Con Dayco KTB379 - Mitsubishi/Proton,RM 68.69
New DAYCO Timing Belt For Proton Satria 94494,RM 308.11
1x Meyle 0500040763 Keilrippenriemen für MITSUBISHI NISSAN ROVER SUZUKI PROTON,RM 48.48
NEW V RIBBED BELT SET FOR RENAULT DACIA NISSAN PROTON KANGOO RAPID FC0 1 GATES,RM 415.38
Genuine GATES Drive Belt for Mitsubishi Galant 4G37 1.8 Litre (11/1988-10/1992),RM 135.41
V-RIBBED FAN BELT FOR PROTON SATRIA 5PK1113 OEM QUALITY,RM 103.67
"BOSCH ZAHNRIEMEN STEUERRIEMEN 1 987 949 064 P FÜR HYUNDAI PONY EXCEL,PONY",RM 121.65
"ZAHNRIEMEN STEUERRIEMEN DAYCO 94195 I FÜR KIA JOICE 2.0 2L 102KW,88KW",RM 141.82
"ZAHNRIEMEN STEUERRIEMEN CONTITECH CT738 P FÜR PROTON PERSONA 400,WIRA 1.3L,1.5L",RM 162.19
Balance Shaft Belt fits MITSUBISHI LANCER 1.8 2.0 2.0D 89 to 08 QH MD192295 New,RM 94.23
1x Meyle 0500040763 V-Ribbed for Mitsubishi Nissan Rover Suzuki Proton,RM 200.93
ZAHNRIEMEN STEUERRIEMEN GATES 5550XS P FÜR PROTON IMPIAN 1.8 1.8L 93KW,RM 269.13
GATES Drive Belt Kit for Proton Savvy 1149cc 1.2 October 2005 to October 2012,RM 497.15
New ListingProton Satria 94-05 Drivers Electric Window Regulator,RM 201.76
TIMING BELT FOR PROTON SATRIA 50092 PREMIUM QUALITY,RM 121.11
Timing Belt fits MITSUBISHI GALANT Mk5 1.8 92 to 96 QH MD176387 MD186376 Quality,RM 165.03
VRIBBED BELT FOR PROTON PERSONA/400/Hatchback/300 WIRA/Sedan/Aeroback SATRIA,RM 118.15
New ListingExhaust Front / Down Pipe + Fitting Kit fits PROTON WIRA 1.5 Front 94 to 97 4G15,RM 292.19
ENGINE TIMING BELT CAM BELT CONTITECH CT1008 A FOR PROTON IMPIAN 1.6 1.6L 76KW,RM 242.41
New ListingPROTON GEN-2 MK1 2004-2014 STEERING PUMP 1.6 PETROL,RM 237.30
Proton Jumbuck Persona Gti Satria Engine Mount Slotted Insert Set Upgrade 4G93,RM 683.52
New ListingPROTON GEN-2 MK1 2004-2014 WIPER LINKAGE PW 851713,RM 237.30
Timing Belt fits CHEVROLET MATIZ M2 1.0 2005 on QH D96610029 96610029 Quality,RM 196.59
ZAHNRIEMEN STEUERRIEMEN DAYCO 94216 I NEU OE QUALITÄT,RM 137.24
GOODYEA TIMING BELT FOR HYUNDAI MITSUBISHI PROTON F1038H 94216 CT738,RM 106.75
KEILRIPPENRIEMEN FÜR FIAT MITSUBISHI PROTON GATES 5PK1083,RM 116.61
TIMING BELT FOR PROTON WIRA 50117 PREMIUM QUALITY,RM 159.92
Distributor New Proton Persona Wira T2T58272 MD328420,RM 593.11
Brand New DAYCO Timing Belt to fit Proton S16 2009-2022,RM 329.33
ENGINE TIMING BELT CAM BELT GATES 5283XS P NEW OE REPLACEMENT,RM 153.99
DAYCO Timing Belt Kit FOR Proton M21 Oct 1997-Nov 2000 1.8L 16V MPFI 4G93,RM 557.35
5 SPARCO - RACING SPORT MUDFLAPS ,RM 155.00
1000B334 FULL GASKET KIT MITSUBISHI 4B11/12 FOR LANCER OUTLANDER 2.0 LTR,RM 228.71
